{
  "schemaVersion": 1,
  "lane": "experience",
  "health": "green",
  "phase": "M0",
  "progress": 12,
  "summary": "Plan revised for one-state voice scope (D-experience-004); slot decision accepted; ModuleHost + onboarding events proposed (D-experience-005)",
  "now": [
    "Waiting on contracts' Profile v2 redefinition and API.md"
  ],
  "next": [
    "M1 when a person says go: @peak-state/app scaffold, five stub screens, voice onboarding screen on a scripted event stream"
  ],
  "blockers": [],
  "updatedAt": "2026-10-03T14:35:50Z",
  "session": {
    "id": "session_01HF7U18q2La6qiCg7MLzD8U",
    "url": "https://claude.ai/code/session_01HF7U18q2La6qiCg7MLzD8U",
    "branch": "lane/experience"
  }
}
