{
  "schemaVersion": 1,
  "lane": "reps",
  "health": "green",
  "phase": "M0",
  "progress": 10,
  "summary": "Plan revised for one-state scope: own step order + drivers, anchor step at peak (D-reps-005 supersedes 002), onboarding reps (D-reps-006)",
  "now": [
    "Revision 2 pushed; waiting for contracts' new state shape and a person's go for M1"
  ],
  "next": [
    "M1: script generator from the contracts one-state fixture"
  ],
  "blockers": [],
  "updatedAt": "2026-10-03T14:36:08Z",
  "session": {
    "id": "session_01RDNjLSV8PzwxBe8GAVmvnW",
    "url": "https://claude.ai/code/session_01RDNjLSV8PzwxBe8GAVmvnW",
    "branch": "lane/reps"
  }
}
